{
  "anonymous_arm_id": "ARM-A",
  "api_billing_used": false,
  "api_key_used": false,
  "attempt_hash": "715990e1ef5b619bed493ff300cf56198f161fc2b945ab7154acf57816330f08",
  "attempt_id": "EXP-CASE-001-ARM-A-R2-A03",
  "auth_mode": "CHATGPT_MANAGED_CODEX",
  "budget_hash": "389c24e9155da753a389b50cf073481cd3dfd2649f4d2de4c740f715c6fe6c51",
  "cached_input_tokens": null,
  "case_id": "CASE-001",
  "cell_id": "CASE-001-ARM-A-R2",
  "codex_version": "0.147.0",
  "cohort_hash": "db663586c8d86c12e72da19872a34ab9cdd5070b050d8ebd4a9a56b949bc2058",
  "cohort_id": "PHASE-002D-NEW_MODEL_COHORT-GPT-5-6-SOL-MEDIUM",
  "completion_status": "COMPLETED",
  "duration_seconds": 240.183696,
  "end_time": "2026-09-01T13:16:45.268253Z",
  "event_summary": {
    "item.completed": 12,
    "item.started": 11,
    "thread.started": 1,
    "turn.completed": 1,
    "turn.started": 1
  },
  "exclusion_reasons": [
    "NO_HARD_FAILURE"
  ],
  "execution_kind": "REAL_CODEX",
  "exit_code": 0,
  "failure_class": null,
  "files_written": [],
  "fixture_hash": "5c453d492549ffd336b0ec8e1e66cd0d7404755f81743a7493faff9c996ce873",
  "fresh_session": true,
  "hard_failures": [
    "HARD-FAIL-003"
  ],
  "input_mutated": false,
  "input_tokens": 228574,
  "manual_intervention": false,
  "mcp_policy": "DISABLED_REQUIRED",
  "model": "gpt-5.6-sol",
  "network_policy": "DISABLED_REQUIRED",
  "observable_commands": [
    "bash shell_text_sha_redacted"
  ],
  "oracle_hash": "d33ba9e3172641d3c87d8a182f7208ec7e8d8d101ecb91b6e81bc4f7d7631703",
  "oracle_status": "FAIL",
  "output_tokens": 11292,
  "package_hash": "ab7a9611c67b4f14c50feb338c5c027737e0fc4936d046604f4a6c34fef807d5",
  "parser_recovery_used": false,
  "policy_hash": "7615149e7e78fb2a8a76e0a328c0b54c652131f0bf9ecc90d78a2e0ca097a5da",
  "primary_eligible": false,
  "process_evidence_status": "PASS",
  "prompt_hash": "45753b913bbc38c08fdd23fbe021c1904353081e9ebf7f4db0092f1c505947f5",
  "raw_trace_hash": "fb26fd408612268d28a9a7a64ce3be0fb0ce19d349fde05ca0660c1b5ec3eb3f",
  "reasoning_setting": "medium",
  "reasoning_tokens": null,
  "repeat_id": 2,
  "result_hashes": {
    "coverage": "aa1d72f40d09fac67d45cdb81a47d33527f39e02e664a502798ad2e08ccee37b",
    "eligibility": "c8fce14252d7c9eb111078f6c18a430fd4b68339ebeb9508798ea333022456fe",
    "observation": "56d6abc529a925201b3842d2c072e53697ee70f62813691841f0dd2c0e3d4636",
    "oracle": "1a44d08d06d3f26d763445b5edfab768f8931d0581885eb39c0edea897cf5fb1",
    "process_evidence": "76e67acddec2225c4e7e779e5452d6f347c416d00cc6a5a90a939a0dff2f10cf"
  },
  "resume_used": false,
  "retry_of": "EXP-CASE-001-ARM-A-R2-A02",
  "robustness_status": "PENDING_CROSS_REPEAT",
  "runner_hash": "fa648d5c7dc47e9bbe0d9af6ac0e660fa54548909b18818d9f9bbb5bb3c78c99",
  "sandbox": "workspace-write",
  "schedule_block": "BLOCK-002-CASE-001-R2",
  "schedule_hash": "5d0351aa4e00885131aedfefdbaa8e311cf2c299652a38f42f6ecad762c045aa",
  "schedule_order": 1,
  "schema_hash": "2706c0c33510fc7aeba3d4e731134941bd855d76540db7c5944d800576a69123",
  "schema_valid": true,
  "schema_version": "1.0.0",
  "scorer_hash": "f45957211d64b482bf321c1a9715292b6f4f8c33eae059306ce1975422272585",
  "start_time": "2026-09-01T13:12:39.777279Z",
  "stderr_hash": "e77de21c1e505a691aebad28a0609a5e08c718e237765d8455ed6c9dce5cf28a",
  "subject_commit": "5b00fb6b15622783a40162197f757ab322547dc1",
  "task_input_hash": "72ce9e44dbfa2426765d5d7703892d29a626886d9ca82a8d7ddbf78e68c3e59b",
  "transport_profile": "PROXY_INHERITED",
  "workspace_commit": "77020bb85cd91f0ece30d27d9255887efaad0f36"
}
