{
  "anonymous_arm_id": "ARM-C",
  "api_billing_used": false,
  "api_key_used": false,
  "attempt_hash": "7286ffba7db4242622d1fc19c33bfc09df732fb24468029571bf45f6338afadd",
  "attempt_id": "EXP-CASE-001-ARM-C-R1-A01",
  "auth_mode": "CHATGPT_MANAGED_CODEX",
  "budget_hash": "389c24e9155da753a389b50cf073481cd3dfd2649f4d2de4c740f715c6fe6c51",
  "cached_input_tokens": null,
  "case_id": "CASE-001",
  "cell_id": "CASE-001-ARM-C-R1",
  "codex_version": "0.147.0",
  "cohort_hash": "db663586c8d86c12e72da19872a34ab9cdd5070b050d8ebd4a9a56b949bc2058",
  "cohort_id": "PHASE-002D-NEW_MODEL_COHORT-GPT-5-6-SOL-MEDIUM",
  "completion_status": "COMPLETED",
  "duration_seconds": 150.168568,
  "end_time": "2026-09-01T10:59:53.268412Z",
  "event_summary": {
    "item.completed": 7,
    "item.started": 6,
    "thread.started": 1,
    "turn.completed": 1,
    "turn.started": 1
  },
  "exclusion_reasons": [],
  "execution_kind": "REAL_CODEX",
  "exit_code": 0,
  "failure_class": null,
  "files_written": [],
  "fixture_hash": "5c453d492549ffd336b0ec8e1e66cd0d7404755f81743a7493faff9c996ce873",
  "fresh_session": true,
  "hard_failures": [],
  "input_mutated": false,
  "input_tokens": 110798,
  "manual_intervention": false,
  "mcp_policy": "DISABLED_REQUIRED",
  "model": "gpt-5.6-sol",
  "network_policy": "DISABLED_REQUIRED",
  "observable_commands": [
    "bash shell_text_sha_redacted"
  ],
  "oracle_hash": "d33ba9e3172641d3c87d8a182f7208ec7e8d8d101ecb91b6e81bc4f7d7631703",
  "oracle_status": "FAIL",
  "output_tokens": 5883,
  "package_hash": "7a9cb6c6850991f9d708a83c762ffd6f066c024153f39b3c0e7a123f50d68194",
  "parser_recovery_used": false,
  "policy_hash": "7615149e7e78fb2a8a76e0a328c0b54c652131f0bf9ecc90d78a2e0ca097a5da",
  "primary_eligible": true,
  "process_evidence_status": "PASS",
  "prompt_hash": "45753b913bbc38c08fdd23fbe021c1904353081e9ebf7f4db0092f1c505947f5",
  "raw_trace_hash": "56b5793124a12b81f1c2811122d1ee6ba3e31568880cf44ec4d76e8cb9510ce4",
  "reasoning_setting": "medium",
  "reasoning_tokens": null,
  "repeat_id": 1,
  "result_hashes": {
    "coverage": "56207f1173d808bda515cdaf1e9e9662b1fe4c7e08a6350936bf3fa2a9236d31",
    "eligibility": "6e093b3cb3b1323a5553f16d35e1f1fe2bdddc38856c4ed73b7cb6e1aee8517d",
    "observation": "6d90f0404d21ca3a3924e7c2490ff102f8d9c72da71b4f05b38eea92bdd0ded1",
    "oracle": "02d73f9a04bbe00a17e04b9aceee62e8355efd9acebc1162443e38d170c6e6f7",
    "process_evidence": "26afca2b5c699f716762404653b5b585e22603a694cdc83c5955af928507037d"
  },
  "resume_used": false,
  "retry_of": null,
  "robustness_status": "PENDING_CROSS_REPEAT",
  "runner_hash": "fa648d5c7dc47e9bbe0d9af6ac0e660fa54548909b18818d9f9bbb5bb3c78c99",
  "sandbox": "workspace-write",
  "schedule_block": "BLOCK-001-CASE-001-R1",
  "schedule_hash": "5d0351aa4e00885131aedfefdbaa8e311cf2c299652a38f42f6ecad762c045aa",
  "schedule_order": 1,
  "schema_hash": "2706c0c33510fc7aeba3d4e731134941bd855d76540db7c5944d800576a69123",
  "schema_valid": true,
  "schema_version": "1.0.0",
  "scorer_hash": "f45957211d64b482bf321c1a9715292b6f4f8c33eae059306ce1975422272585",
  "start_time": "2026-09-01T10:57:16.990086Z",
  "stderr_hash": "5bd16672cd750ee05cf16541ab35bc32b4ba2a86b81cec162114bb147335094d",
  "subject_commit": "981414245a20a282bb98d20d75003d51a948536c",
  "task_input_hash": "72ce9e44dbfa2426765d5d7703892d29a626886d9ca82a8d7ddbf78e68c3e59b",
  "transport_profile": "PROXY_INHERITED",
  "workspace_commit": "0e4590337e6c0da95933e1cfc5d9dfd0c735803d"
}
