{
  "anonymous_arm_id": "ARM-A",
  "api_billing_used": false,
  "api_key_used": false,
  "attempt_hash": "68eb3af786937c77a8f54164e2a977ed85b886c09373bc20a917a6efae19c613",
  "attempt_id": "EXP-CASE-002-ARM-A-R2-A01",
  "auth_mode": "CHATGPT_MANAGED_CODEX",
  "budget_hash": "389c24e9155da753a389b50cf073481cd3dfd2649f4d2de4c740f715c6fe6c51",
  "cached_input_tokens": null,
  "case_id": "CASE-002",
  "cell_id": "CASE-002-ARM-A-R2",
  "codex_version": "0.147.0",
  "cohort_hash": "db663586c8d86c12e72da19872a34ab9cdd5070b050d8ebd4a9a56b949bc2058",
  "cohort_id": "PHASE-002D-NEW_MODEL_COHORT-GPT-5-6-SOL-MEDIUM",
  "completion_status": "COMPLETED",
  "duration_seconds": 278.259572,
  "end_time": "2026-09-01T11:55:45.910882Z",
  "event_summary": {
    "item.completed": 18,
    "item.started": 16,
    "thread.started": 1,
    "turn.completed": 1,
    "turn.started": 1
  },
  "exclusion_reasons": [],
  "execution_kind": "REAL_CODEX",
  "exit_code": 0,
  "failure_class": null,
  "files_written": [
    "case/output/audit_handoff.json",
    "case/output/workflow_state.json"
  ],
  "fixture_hash": "5c453d492549ffd336b0ec8e1e66cd0d7404755f81743a7493faff9c996ce873",
  "fresh_session": true,
  "hard_failures": [],
  "input_mutated": false,
  "input_tokens": 349592,
  "manual_intervention": false,
  "mcp_policy": "DISABLED_REQUIRED",
  "model": "gpt-5.6-sol",
  "network_policy": "DISABLED_REQUIRED",
  "observable_commands": [
    "bash shell_text_sha_redacted"
  ],
  "oracle_hash": "d33ba9e3172641d3c87d8a182f7208ec7e8d8d101ecb91b6e81bc4f7d7631703",
  "oracle_status": "PASS",
  "output_tokens": 13186,
  "package_hash": "ab7a9611c67b4f14c50feb338c5c027737e0fc4936d046604f4a6c34fef807d5",
  "parser_recovery_used": false,
  "policy_hash": "7615149e7e78fb2a8a76e0a328c0b54c652131f0bf9ecc90d78a2e0ca097a5da",
  "primary_eligible": true,
  "process_evidence_status": "PASS",
  "prompt_hash": "45753b913bbc38c08fdd23fbe021c1904353081e9ebf7f4db0092f1c505947f5",
  "raw_trace_hash": "0162cc68bc5963f62266ae18c1b475909d5522498427e5305113e3e85d2d9444",
  "reasoning_setting": "medium",
  "reasoning_tokens": null,
  "repeat_id": 2,
  "result_hashes": {
    "coverage": "b1cc190c67d42c4a7730872bf69eb2f5b2574320829f403ac7ef9333369a7e83",
    "eligibility": "f0eaebaeb3a517182fd3053c7c97a2ca3640a9644cbd3fa5e29a5c6d2060ebf7",
    "observation": "248b9ef837c10ffffce23cf4411e50bc66e46d516ca42f2e3f97e5eb219466fa",
    "oracle": "c5083f1b2088691c10634bf9755e80df7b9e7d2a74caced0dd6dc4035bd04e90",
    "process_evidence": "2c8f068af8335f53f6b30bba7e1f4d7e465fa467f6bb9806093686788de12a73"
  },
  "resume_used": false,
  "retry_of": null,
  "robustness_status": "PENDING_CROSS_REPEAT",
  "runner_hash": "fa648d5c7dc47e9bbe0d9af6ac0e660fa54548909b18818d9f9bbb5bb3c78c99",
  "sandbox": "workspace-write",
  "schedule_block": "BLOCK-004-CASE-002-R2",
  "schedule_hash": "5d0351aa4e00885131aedfefdbaa8e311cf2c299652a38f42f6ecad762c045aa",
  "schedule_order": 3,
  "schema_hash": "2706c0c33510fc7aeba3d4e731134941bd855d76540db7c5944d800576a69123",
  "schema_valid": true,
  "schema_version": "1.0.0",
  "scorer_hash": "f45957211d64b482bf321c1a9715292b6f4f8c33eae059306ce1975422272585",
  "start_time": "2026-09-01T11:51:00.643220Z",
  "stderr_hash": "d0ab0a42407b13ccf6dfd13d2eb1f6ca2914e6a4a7097a430c42f96c1064ab79",
  "subject_commit": "9e9cd7f5c60ae7bf5fc2c1371160c8aa30ec5004",
  "task_input_hash": "48420bcc8b6f1e229d2b7b65530f69f485c680225a5b2b54f427370ae94b2d63",
  "transport_profile": "PROXY_INHERITED",
  "workspace_commit": "26dc47c1aef02276a7f3860fd8b7f6be0a19052e"
}
