{
  "anonymous_arm_id": "ARM-C",
  "api_billing_used": false,
  "api_key_used": false,
  "attempt_hash": "3854de86546acfa7f26cd257c9b3a0ef46d01414aaf8b70859680f0cf036fe1e",
  "attempt_id": "EXP-CASE-001-ARM-C-R2-A01",
  "auth_mode": "CHATGPT_MANAGED_CODEX",
  "budget_hash": "389c24e9155da753a389b50cf073481cd3dfd2649f4d2de4c740f715c6fe6c51",
  "cached_input_tokens": null,
  "case_id": "CASE-001",
  "cell_id": "CASE-001-ARM-C-R2",
  "codex_version": "0.147.0",
  "cohort_hash": "db663586c8d86c12e72da19872a34ab9cdd5070b050d8ebd4a9a56b949bc2058",
  "cohort_id": "PHASE-002D-NEW_MODEL_COHORT-GPT-5-6-SOL-MEDIUM",
  "completion_status": "COMPLETED",
  "duration_seconds": 104.197607,
  "end_time": "2026-09-01T11:27:53.277715Z",
  "event_summary": {
    "item.completed": 6,
    "item.started": 5,
    "thread.started": 1,
    "turn.completed": 1,
    "turn.started": 1
  },
  "exclusion_reasons": [],
  "execution_kind": "REAL_CODEX",
  "exit_code": 0,
  "failure_class": null,
  "files_written": [],
  "fixture_hash": "5c453d492549ffd336b0ec8e1e66cd0d7404755f81743a7493faff9c996ce873",
  "fresh_session": true,
  "hard_failures": [],
  "input_mutated": false,
  "input_tokens": 93134,
  "manual_intervention": false,
  "mcp_policy": "DISABLED_REQUIRED",
  "model": "gpt-5.6-sol",
  "network_policy": "DISABLED_REQUIRED",
  "observable_commands": [
    "bash shell_text_sha_redacted"
  ],
  "oracle_hash": "d33ba9e3172641d3c87d8a182f7208ec7e8d8d101ecb91b6e81bc4f7d7631703",
  "oracle_status": "PASS",
  "output_tokens": 4960,
  "package_hash": "7a9cb6c6850991f9d708a83c762ffd6f066c024153f39b3c0e7a123f50d68194",
  "parser_recovery_used": false,
  "policy_hash": "7615149e7e78fb2a8a76e0a328c0b54c652131f0bf9ecc90d78a2e0ca097a5da",
  "primary_eligible": true,
  "process_evidence_status": "PASS",
  "prompt_hash": "45753b913bbc38c08fdd23fbe021c1904353081e9ebf7f4db0092f1c505947f5",
  "raw_trace_hash": "6ea08c7dc5cbdb9e244b77500d0e02c7ee359bdbfb2d1badb720f2c637792b7d",
  "reasoning_setting": "medium",
  "reasoning_tokens": null,
  "repeat_id": 2,
  "result_hashes": {
    "coverage": "f8d808a888f0bfdfdf8ecf6d00d125fd46bc37207559128d2f981dfd1a368ef6",
    "eligibility": "ad58c1c351946ae0e06f669d6707418d5170c98c0f623b61f788f72f62869525",
    "observation": "38f06bf43c13a48c12c589402a13e9f36a7da2a9533bdbddebc9f3131e736c77",
    "oracle": "20a6f43c227103e06fdaaca075e02bde59129e2faccc0c596311e75dc7591618",
    "process_evidence": "7dc081a6929351d62e33cc125e12512814a70c534cdb91c81f85198b3acdf1d0"
  },
  "resume_used": false,
  "retry_of": null,
  "robustness_status": "PENDING_CROSS_REPEAT",
  "runner_hash": "fa648d5c7dc47e9bbe0d9af6ac0e660fa54548909b18818d9f9bbb5bb3c78c99",
  "sandbox": "workspace-write",
  "schedule_block": "BLOCK-002-CASE-001-R2",
  "schedule_hash": "5d0351aa4e00885131aedfefdbaa8e311cf2c299652a38f42f6ecad762c045aa",
  "schedule_order": 3,
  "schema_hash": "2706c0c33510fc7aeba3d4e731134941bd855d76540db7c5944d800576a69123",
  "schema_valid": true,
  "schema_version": "1.0.0",
  "scorer_hash": "f45957211d64b482bf321c1a9715292b6f4f8c33eae059306ce1975422272585",
  "start_time": "2026-09-01T11:26:05.720533Z",
  "stderr_hash": "fe5038576a6ec3059b949dcbfc17b9daf4c27b90873c8a9d76f3e15bb834f778",
  "subject_commit": "01c6267ad8507a4f4196d8d7f7834e03294750e4",
  "task_input_hash": "72ce9e44dbfa2426765d5d7703892d29a626886d9ca82a8d7ddbf78e68c3e59b",
  "transport_profile": "PROXY_INHERITED",
  "workspace_commit": "6746735de2fcf5721a7f84b55df4a7ca4dd04fe5"
}
