{
  "anonymous_arm_id": "ARM-B",
  "api_billing_used": false,
  "api_key_used": false,
  "attempt_hash": "352e94d82c543651875c06d96b36f091c82063f52a7a43b9e3ec8a6dd00ec5c2",
  "attempt_id": "EXP-CASE-004-ARM-B-R1-A01",
  "auth_mode": "CHATGPT_MANAGED_CODEX",
  "budget_hash": "389c24e9155da753a389b50cf073481cd3dfd2649f4d2de4c740f715c6fe6c51",
  "cached_input_tokens": null,
  "case_id": "CASE-004",
  "cell_id": "CASE-004-ARM-B-R1",
  "codex_version": "0.147.0",
  "cohort_hash": "db663586c8d86c12e72da19872a34ab9cdd5070b050d8ebd4a9a56b949bc2058",
  "cohort_id": "PHASE-002D-NEW_MODEL_COHORT-GPT-5-6-SOL-MEDIUM",
  "completion_status": "COMPLETED",
  "duration_seconds": 132.978988,
  "end_time": "2026-09-01T12:07:27.052835Z",
  "event_summary": {
    "item.completed": 6,
    "item.started": 5,
    "thread.started": 1,
    "turn.completed": 1,
    "turn.started": 1
  },
  "exclusion_reasons": [],
  "execution_kind": "REAL_CODEX",
  "exit_code": 0,
  "failure_class": null,
  "files_written": [],
  "fixture_hash": "5c453d492549ffd336b0ec8e1e66cd0d7404755f81743a7493faff9c996ce873",
  "fresh_session": true,
  "hard_failures": [],
  "input_mutated": false,
  "input_tokens": 101216,
  "manual_intervention": false,
  "mcp_policy": "DISABLED_REQUIRED",
  "model": "gpt-5.6-sol",
  "network_policy": "DISABLED_REQUIRED",
  "observable_commands": [
    "bash shell_text_sha_redacted"
  ],
  "oracle_hash": "d33ba9e3172641d3c87d8a182f7208ec7e8d8d101ecb91b6e81bc4f7d7631703",
  "oracle_status": "FAIL",
  "output_tokens": 5755,
  "package_hash": "908d89f00e4bbab7260c84d5b698171c87ea8c12f86f08ea437289ec8385b26c",
  "parser_recovery_used": false,
  "policy_hash": "7615149e7e78fb2a8a76e0a328c0b54c652131f0bf9ecc90d78a2e0ca097a5da",
  "primary_eligible": true,
  "process_evidence_status": "PASS",
  "prompt_hash": "45753b913bbc38c08fdd23fbe021c1904353081e9ebf7f4db0092f1c505947f5",
  "raw_trace_hash": "f23fe4a343b995b16d46f482e0ae6b8f3a37d6f68370f17695bb5b577ec5588f",
  "reasoning_setting": "medium",
  "reasoning_tokens": null,
  "repeat_id": 1,
  "result_hashes": {
    "coverage": "bd7fe86d473ecc70d2cbd1779aa4691b2ae2ab72c34be990818f8792ab9678db",
    "eligibility": "b33d3de50ac5f987f86c075165aefb4248e44d5b4d691bc7e940c85195478dc0",
    "observation": "7ae9954ca2ce9f128684d4acf1d34ca07c5d3cd50b56af185ca8226eb8a747ce",
    "oracle": "3ff212ec3084c8eefbe9daeda8293630be1e1c43c99caf525614e708e4b6a223",
    "process_evidence": "a56a95f64ec7517856d5b385f5a48c98132f652245b1abed6e30ae5ae4a09e68"
  },
  "resume_used": false,
  "retry_of": null,
  "robustness_status": "PENDING_CROSS_REPEAT",
  "runner_hash": "fa648d5c7dc47e9bbe0d9af6ac0e660fa54548909b18818d9f9bbb5bb3c78c99",
  "sandbox": "workspace-write",
  "schedule_block": "BLOCK-005-CASE-004-R1",
  "schedule_hash": "5d0351aa4e00885131aedfefdbaa8e311cf2c299652a38f42f6ecad762c045aa",
  "schedule_order": 3,
  "schema_hash": "2706c0c33510fc7aeba3d4e731134941bd855d76540db7c5944d800576a69123",
  "schema_valid": true,
  "schema_version": "1.0.0",
  "scorer_hash": "f45957211d64b482bf321c1a9715292b6f4f8c33eae059306ce1975422272585",
  "start_time": "2026-09-01T12:05:10.253283Z",
  "stderr_hash": "1aa26269eb1cc57f86b235a03cda53c004edb5b1e9fc99d4da4f00843293d721",
  "subject_commit": "9e9cd7f5c60ae7bf5fc2c1371160c8aa30ec5004",
  "task_input_hash": "5f4e2945c0a40ab4f506364a1799543dfec2dee352caedccfacbd3f87d90020a",
  "transport_profile": "PROXY_INHERITED",
  "workspace_commit": "050b35271b466049e40eaa326635437d013d37ee"
}
