{
  "anonymous_arm_id": "ARM-A",
  "api_billing_used": false,
  "api_key_used": false,
  "attempt_hash": "40c59bf55e3e9b72a9fda4dc84b51a741b341f4af2befec89a2b5fdbd329cab8",
  "attempt_id": "EXP-CASE-002-ARM-A-R1-A01",
  "auth_mode": "CHATGPT_MANAGED_CODEX",
  "budget_hash": "389c24e9155da753a389b50cf073481cd3dfd2649f4d2de4c740f715c6fe6c51",
  "cached_input_tokens": null,
  "case_id": "CASE-002",
  "cell_id": "CASE-002-ARM-A-R1",
  "codex_version": "0.147.0",
  "cohort_hash": "db663586c8d86c12e72da19872a34ab9cdd5070b050d8ebd4a9a56b949bc2058",
  "cohort_id": "PHASE-002D-NEW_MODEL_COHORT-GPT-5-6-SOL-MEDIUM",
  "completion_status": "COMPLETED",
  "duration_seconds": 207.753478,
  "end_time": "2026-09-01T11:31:27.939662Z",
  "event_summary": {
    "item.completed": 11,
    "item.started": 10,
    "thread.started": 1,
    "turn.completed": 1,
    "turn.started": 1
  },
  "exclusion_reasons": [],
  "execution_kind": "REAL_CODEX",
  "exit_code": 0,
  "failure_class": null,
  "files_written": [
    "case/audit_handoff.json",
    "case/workflow_state.json"
  ],
  "fixture_hash": "5c453d492549ffd336b0ec8e1e66cd0d7404755f81743a7493faff9c996ce873",
  "fresh_session": true,
  "hard_failures": [],
  "input_mutated": false,
  "input_tokens": 210471,
  "manual_intervention": false,
  "mcp_policy": "DISABLED_REQUIRED",
  "model": "gpt-5.6-sol",
  "network_policy": "DISABLED_REQUIRED",
  "observable_commands": [
    "bash shell_text_sha_redacted"
  ],
  "oracle_hash": "d33ba9e3172641d3c87d8a182f7208ec7e8d8d101ecb91b6e81bc4f7d7631703",
  "oracle_status": "PASS",
  "output_tokens": 10260,
  "package_hash": "ab7a9611c67b4f14c50feb338c5c027737e0fc4936d046604f4a6c34fef807d5",
  "parser_recovery_used": false,
  "policy_hash": "7615149e7e78fb2a8a76e0a328c0b54c652131f0bf9ecc90d78a2e0ca097a5da",
  "primary_eligible": true,
  "process_evidence_status": "PASS",
  "prompt_hash": "45753b913bbc38c08fdd23fbe021c1904353081e9ebf7f4db0092f1c505947f5",
  "raw_trace_hash": "2a721457e37b1f2e6a9fd4714a0bcf4d6658c47f5c77ae766f32f6de917cc454",
  "reasoning_setting": "medium",
  "reasoning_tokens": null,
  "repeat_id": 1,
  "result_hashes": {
    "coverage": "1c75da8f7180488be7e58788b302d682f96c94a456f89fa289f1a09296b6c8e5",
    "eligibility": "fcd2b0d298f2ad4f61c8f534a0ed2464f2c8969f8356758b9f333656a063c942",
    "observation": "65014d300b4345c7ca50325ac732a759bb0a1a6d37f2a07bf472e438ab9b23b8",
    "oracle": "92d765c4adc52fa8f8ca57197da58ac98c911ce0d9430579aae92d0d544fd816",
    "process_evidence": "920667afba7d68b8ba71ceae6bd6de9955680244d2141aff86a4ea000aeed98c"
  },
  "resume_used": false,
  "retry_of": null,
  "robustness_status": "PENDING_CROSS_REPEAT",
  "runner_hash": "fa648d5c7dc47e9bbe0d9af6ac0e660fa54548909b18818d9f9bbb5bb3c78c99",
  "sandbox": "workspace-write",
  "schedule_block": "BLOCK-003-CASE-002-R1",
  "schedule_hash": "5d0351aa4e00885131aedfefdbaa8e311cf2c299652a38f42f6ecad762c045aa",
  "schedule_order": 1,
  "schema_hash": "2706c0c33510fc7aeba3d4e731134941bd855d76540db7c5944d800576a69123",
  "schema_valid": true,
  "schema_version": "1.0.0",
  "scorer_hash": "f45957211d64b482bf321c1a9715292b6f4f8c33eae059306ce1975422272585",
  "start_time": "2026-09-01T11:27:53.309206Z",
  "stderr_hash": "f7b97e32b2462d04a413237e4b3a0bd1325847eb1b6b9d284c50449c5f8f7fb7",
  "subject_commit": "01c6267ad8507a4f4196d8d7f7834e03294750e4",
  "task_input_hash": "48420bcc8b6f1e229d2b7b65530f69f485c680225a5b2b54f427370ae94b2d63",
  "transport_profile": "PROXY_INHERITED",
  "workspace_commit": "719e07c74800a70778ca346e0c00e7f2b5170236"
}
