{
  "anonymous_arm_id": "ARM-A",
  "api_billing_used": false,
  "api_key_used": false,
  "attempt_hash": "c37c97baa3b0a2fb3414336337437edfc412810e136e5e8ef2b620b78198d5dd",
  "attempt_id": "EXP-CASE-004-ARM-A-R2-A01",
  "auth_mode": "CHATGPT_MANAGED_CODEX",
  "budget_hash": "389c24e9155da753a389b50cf073481cd3dfd2649f4d2de4c740f715c6fe6c51",
  "cached_input_tokens": null,
  "case_id": "CASE-004",
  "cell_id": "CASE-004-ARM-A-R2",
  "codex_version": "0.147.0",
  "cohort_hash": "db663586c8d86c12e72da19872a34ab9cdd5070b050d8ebd4a9a56b949bc2058",
  "cohort_id": "PHASE-002D-NEW_MODEL_COHORT-GPT-5-6-SOL-MEDIUM",
  "completion_status": "FAILED",
  "duration_seconds": 259.621277,
  "end_time": "2026-09-01T12:30:41.374925Z",
  "event_summary": {
    "item.completed": 15,
    "item.started": 14,
    "thread.started": 1,
    "turn.completed": 1,
    "turn.started": 1
  },
  "exclusion_reasons": [
    "COMPLETION_COMPLETE",
    "NO_HARD_FAILURE",
    "ORACLE_EXECUTED",
    "PROCESS_VERIFIED",
    "RESULT_PRESENT",
    "SCHEMA_VALID"
  ],
  "execution_kind": "REAL_CODEX",
  "exit_code": 0,
  "failure_class": "POLICY_VIOLATION",
  "files_written": [],
  "fixture_hash": "5c453d492549ffd336b0ec8e1e66cd0d7404755f81743a7493faff9c996ce873",
  "fresh_session": true,
  "hard_failures": [
    "HARD-FAIL-003"
  ],
  "input_mutated": false,
  "input_tokens": 323593,
  "manual_intervention": false,
  "mcp_policy": "DISABLED_REQUIRED",
  "model": "gpt-5.6-sol",
  "network_policy": "DISABLED_REQUIRED",
  "observable_commands": [
    "bash shell_text_sha_redacted"
  ],
  "oracle_hash": "d33ba9e3172641d3c87d8a182f7208ec7e8d8d101ecb91b6e81bc4f7d7631703",
  "oracle_status": "NOT_RUN",
  "output_tokens": 12734,
  "package_hash": "ab7a9611c67b4f14c50feb338c5c027737e0fc4936d046604f4a6c34fef807d5",
  "parser_recovery_used": false,
  "policy_hash": "7615149e7e78fb2a8a76e0a328c0b54c652131f0bf9ecc90d78a2e0ca097a5da",
  "primary_eligible": false,
  "process_evidence_status": "FAIL",
  "prompt_hash": "45753b913bbc38c08fdd23fbe021c1904353081e9ebf7f4db0092f1c505947f5",
  "raw_trace_hash": "da7730620e725a11d1685afe8ce4cd27da2b2b3069c23a855e45e75fae299505",
  "reasoning_setting": "medium",
  "reasoning_tokens": null,
  "repeat_id": 2,
  "result_hashes": {
    "coverage": "a51f90510de3dfe647c753cf0e925b6a6b5b572d481ae46ab001cb1a9458dbf6",
    "eligibility": "76a3463041fe221aa95d9414f7343bf2378aa94dca8835eb263a161d8d3378a0",
    "observation": null,
    "oracle": "f9a81f211a3a3f6f5011643d05428fdd0f08a0aad13b8dbf4dbc6f89aeb9a9f2",
    "process_evidence": "f2e1a377a66efba70f8dcce102912a641033c6ce7d3d8996ca1293f90e5f89cc"
  },
  "resume_used": false,
  "retry_of": null,
  "robustness_status": "PENDING_CROSS_REPEAT",
  "runner_hash": "fa648d5c7dc47e9bbe0d9af6ac0e660fa54548909b18818d9f9bbb5bb3c78c99",
  "sandbox": "workspace-write",
  "schedule_block": "BLOCK-006-CASE-004-R2",
  "schedule_hash": "5d0351aa4e00885131aedfefdbaa8e311cf2c299652a38f42f6ecad762c045aa",
  "schedule_order": 3,
  "schema_hash": "2706c0c33510fc7aeba3d4e731134941bd855d76540db7c5944d800576a69123",
  "schema_valid": false,
  "schema_version": "1.0.0",
  "scorer_hash": "f45957211d64b482bf321c1a9715292b6f4f8c33eae059306ce1975422272585",
  "start_time": "2026-09-01T12:26:11.942466Z",
  "stderr_hash": "d5b54db1c32621b4bd59c1b0189c7195fa5fcddc8c84e38efd6aa909c180e35b",
  "subject_commit": "1cafef225ee413c8c190745e8c980b5fe917ec45",
  "task_input_hash": "5f4e2945c0a40ab4f506364a1799543dfec2dee352caedccfacbd3f87d90020a",
  "transport_profile": "PROXY_INHERITED",
  "workspace_commit": "da887651509ed0b53038ac347ba4b7f7884aa5c5"
}
